Leaf Wearables,"Fashion, Information Technology, Jewelry, Wearables","New Delhi, Delhi, India",Leaf Wearables is a tech startup that designs smart jewelry products for women’s safety.,$1M to $10M,Closed,2015,support@leafwearables.com,—,"Clothing and Apparel, Consumer Electronics, Consumer Goods, Design, Hardware, Information Technology",5,"Avinash Bansal, Ayush Banka, Chiraag Kapil, Manik Mehta, Paras Batra",11-50,1,Seed,"$250,000","$250,000",—,—,—,—,—,—,—
Appinventiv,—,"Noida, Uttar Pradesh, India",A leading global Mobile App Development Firm empowering startups & Fortune 500 Companies to bridge the gap between ideas and reality.,—,Active,2015,info@appinventiv.com,—,"Apps, Internet Services, Mobile, Software",2,"Prateek Saxena, Sudeep Srivastava",1001-5000,—,—,—,—,—,—,"304,006",-18.23%,13.79%,—,487
LexComply,"Compliance, Legal, SaaS, Software","New Delhi, Delhi, India",India's Leading GRC technology solutions provider offering 13 SaaS-based risk & compliance solutions,Less than $1M,Active,2015,info@lexcomply.com,Seed,"Professional Services, Software",3,"Gaurav Jain, Pooja Aggarwal, Thomas Abraham",11-50,1,Seed,"₹500,000","₹500,000",—,—,"4,545",-59.44%,-36.65%,—,458
First Eat,"Fitness, Food Delivery, Food Processing, Wellness","Gurgaon, Haryana, India","A health and nutrition startup delivering freshly prepared, healthy, and affordable meals",Less than $1M,Closed,2015,contact@firsteat.in,Seed,"Food and Beverage, Health Care, Sports, Transportation",4,"Mannat Wadehra, Rishabh Tickoo, Saikat Bagchi, Shitiz Dogra",1-10,1,Seed,"$200,000","$200,000",—,—,—,—,—,—,—
Talrop,"Commercial, Education, Incubators","Kochi, Kerala, India","Building a startup ecosystem in Kerala focused on education, technology, jobs, and entrepreneurship",$10M to $50M,Active,2015,hello@talrop.com,—,"Education, Financial Services, Lending and Investments, Other",4,"Anas Abdul Gafoor, Safeer Najumudeen, Shameer Khan, Sobir Najumudeen",101-250,—,—,—,—,Growing,High,"60,434",89.98%,228.08%,—,"1,250"
Applop Mobile Solutions,"Internet, Mobile, Mobile Apps","Gurgaon, Haryana, India","Make mobile app without coding, in 5 minutes",—,Active,2015,care@applop.com,Seed,"Apps, Internet Services, Mobile, Software",1,Rahul Singhal,11-50,2,Seed,"$350,000","$350,000",—,—,—,—,—,—,—
BookMyChotu,"CleanTech, Internet, Professional Services","New Delhi, Delhi, India",On-demand helpers providing soft services,—,Active,2015,info@convenientcart.com,Seed,"Internet Services, Other, Sustainability",1,Satjeet Singh Bedi,11-50,1,Seed,"$15,000","$15,000",—,—,—,—,—,—,—
Shoppingkart24,"B2B, B2C, E-Commerce, Handmade","Varanasi, Uttar Pradesh, India","Online shopping portal promoting Geographical Indication (GI), handicrafts, handloom, & agri products",$1M to $10M,Active,2016,prateekbsingh@shoppingkart24.com,Seed,"Commerce and Shopping, Community and Lifestyle, Social Impact",2,"Prateek B Singh, Vidya Singh",11-50,1,Seed,"$140,000","$140,000",—,—,"1,277",—,—,—,0
University Living,"Education, Marketplace","New Delhi, Delhi, India",Online global student housing marketplace,$1M to $10M,Active,2015,care@universityliving.com,Seed,"Commerce and Shopping, Education",2,"Mayank Maheshwari, Saurabh Arora",101-250,1,Seed,—,—,Growing,High,"251,690",14.29%,-34.06%,—,302
Moovlee,"Software, Transportation","Bengaluru, Karnataka, India",Early stage technology startup in the on-demand taxi transportation industry,—,Active,2016,contactus@moovlee.com,—,"Software, Transportation",1,Amlan Dutta,1-10,1,—,—,"$54,000",—,—,93,—,—,—,327
Sniffton Technologies (P) Ltd,"Information Technology, IT Infrastructure, Software Engineering","New Delhi, Delhi, India",Sniffton Technologies is a Startup Technology Company. It providing IT and Engineering Services,$1M to $10M,Active,2016,crunchbase@sniffton.in,-,"Information Technology, Science and Engineering, Software",2,"A. J, San Takur",51-100,1,Seed,"₹100,000","₹100,000",-,-,-,-,-,-,-
TradingBells,"Information Technology, Professional Services, Trading Platform","Mumbai, Maharashtra, India",TradingBells is a discount broking start-up,$1B to $10B,Active,2016,info@tradingbells.com,-,"Financial Services, Information Technology, Lending and Investments, Other",2,"Amit Gupta, Parth Nyati",11-50,1,Seed,"$295,000","$295,000",-,-,768,18.34%,-94.72%,-,106
Taraltec Solutions,Water Purification,"Mumbai, Maharashtra, India",Taraltec® Solutions is a startup Indian company with a social purpose built right into its business.,-,Active,2017,mail@taraltec.com,-,Sustainability,-,-,11-50,1,-,-,"₹500,000",-,-,-,-,-,-,1
Poshtick,"Fitness, Food and Beverage, Health Care, Personal Health, Wellness","Noida, Uttar Pradesh, India",Poshtick is a health and wellness startup,$1M to $10M,Active,2016,hello@poshtick.com,-,"Food and Beverage, Health Care, Sports",2,"Pranav Malia, Pranav Sharma",1-10,1,Seed,"$450,000","$450,000",-,-,-,-,-,-,-
DaddysRoad Pvt Ltd,"Automotive, Information Technology, Internet of Things","Bangalore, Karnataka, India",Affordable vehicle safety solutions,Less than $1M,Active,2016,info@daddysroad.com,-,"Information Technology, Internet Services, Transportation",3,"Jiju Joseph, Jiju Vilavinal George, Vineeth PK",1-10,1,Seed,"$30,000","$30,000",-,-,444,357.73%,-,-,0
Social Alpha,—,"Bangalore, Karnataka, India","On a mission to drive economic growth, social justice & climate action through the power of entrepreneurship and market-creating innovations",—,Active,2015,—,"Early Stage Venture, Grant, Seed",—,1,Manoj Kumar,101-250,—,—,—,—,—,—,"7,945",-43.55%,-36.31%,—,342
VAPP,"Real Estate, Tourism","Delhi, Delhi, India","VAPP is a Delhi-based startup, works in platforms used for real estate and tourism industry.",—,Active,2017,—,—,"Real Estate, Travel and Tourism",—,—,1-10,2,Seed,"₹3,500,000","₹3,500,000",—,—,—,—,—,—,—
Faclon Labs,"Analytics, Cloud Computing, Computer, Software","Mumbai, Maharashtra, India",Faclon is an IoT and data analytics based tech startup building products to make cities and villages smart.,$1M to $10M,Active,2016,reachus@faclon.com,—,"Consumer Electronics, Data and Analytics, Hardware, Internet Services, Software",3,"Archit Naraniwal, Rishi Sharma, Utkarsh Srivastava",51-100,3,Seed,—,—,—,—,"2,829",37.53%,23.47%,—,363
Happy Cow Dairy,"Agriculture, Farming, Food and Beverage, Food Processing","Mumbai, Maharashtra, India",Happy Cow Dairy is a startup which aggregates milk from dairy farmers in rural Maharashtra.,—,Active,2017,info@happycowdairy.co.in,—,"Agriculture and Farming, Food and Beverage",1,Sarad Garodia,251-500,1,Seed,"₹597,756","₹597,756",—,—,—,—,—,—,—
Infusion Beverages,"Consumer Goods, Food and Beverage, Water","New Delhi, Delhi, India",Infusion Beverages is an India-based food and beverage startup.,—,Active,2016,—,—,"Consumer Goods, Food and Beverage, Natural Resources",3,"Chetanya Golechha, Mragank Gurjar, Utsav Jain",1-10,1,Seed,"$453,874","$453,874",—,—,—,—,—,—,—
Blackboard Radio,Education,"New Delhi, Delhi, India",Blackboard Radio is an edtech startup.,—,Active,2016,—,—,Education,3,"Arpit Jain, Shubham Gupta, Vatsal Dusad",1-10,2,—,"$100,000","$100,000",—,—,"1,464",-94.59%,1557.81%,—,23
Machadalo,"Advertising, Consulting, Marketing","Mumbai, Maharashtra, India",Machadalo is an innovative startup as it has created a new category,—,Active,2015,info@machadalo.com,—,"Advertising, Professional Services, Sales and Marketing",4,"Anupam Sourabh, Naveen Sharma, Nitin Jain, Pankaj Kandhari",11-50,1,Seed,"$175,000","$175,000",—,—,171,-65.59%,-32.05%,—,106
Wandertrails,"Consumer, Travel","Bengaluru, Karnataka, India",Wandertrails is a online travel startup,$1M to $10M,Active,2016,connect@wandertrails.com,—,"Other, Travel and Tourism",5,"Hari Gangadharan, Narayan Menon, Pranav Kumar, Sruti Ramesh Chander, Vishnu Menon",51-100,1,Seed,"$1,000,000","$1,000,000",—,—,—,—,—,—,—
Ekeeda,"Apps, E-Learning, EdTech, Education, Higher Education, Software, Video","Mumbai, Maharashtra, India","Ekeeda.com is e-learning platform for Engg students. We provide videos & other content for ESE, GATE & curriculum of 60+ Engg Universities",—,Active,2016,mahesh.w@ekeeda.com,—,"Apps, Education, Media and Entertainment, Software, Video",2,"Anagha Wagh, Mahesh Wagh",101-250,1,Seed,"$65,000","$65,000",—,—,"9,645",-28.63%,-23.81%,—,544
CutShort,"Artificial Intelligence (AI), Internet, Machine Learning, SaaS, Software","Pune, Maharashtra, India","AI-based recruitment platform and SaaS software used by 8000+ companies, from startups to product giants like Google.",$1M to $10M,Active,2015,hello@cutshort.io,—,"Artificial Intelligence (AI), Data and Analytics, Internet Services, Science and Engineering, Software",1,Nikunj Verma,11-50,—,—,—,—,—,—,"606,594",36.70%,-32.72%,—,329
Remedo Healthcare,"Health Care, Medical, Telehealth","Noida, Uttar Pradesh, India",Remedo Healthcare is a telemedicine startup focused on providing doctors with a platform to connect with their existing patients.,—,Active,2016,—,—,Health Care,3,"Harsh Bansal, Richeek Arya, Ruchir Mehra",11-50,4,Seed,—,—,—,—,"42,012",808.37%,268.45%,—,759
Mivi,"Consumer Electronics, Electronics, Manufacturing","Hyderabad, Andhra Pradesh, India","Mivi manufactures electronic accessories such as wireless Bluetooth headphones, speakers, chargers, cables, and more.",—,Active,2016,support@mivi.in,—,"Consumer Electronics, Hardware, Manufacturing",—,—,501-1000,1,—,—,—,Growing,Medium,"1,884,033",40.25%,-52.04%,—,271
IOT Pot,"Consumer Electronics, Cooking, Food and Beverage, Internet of Things, Machine Learning, Software","Bangalore, Karnataka, India",IOT Pot is a Connected Cooking Platform startup with IoT and Voice Assisted and Machine Learning solutions that helps in cooking.,Less than $1M,Active,2016,bvshete@iotpot.com,—,"Artificial Intelligence (AI), Consumer Electronics, Data and Analytics, Food and Beverage, Hardware, Internet Services, Software",2,"Asha Shete, Bahubali Shete",1-10,1,Seed,"$200,000","$200,000",—,—,—,—,—,—,—
Couture.ai,"Artificial Intelligence (AI), Big Data, Computer Vision, Developer Platform, Machine Learning, Natural Language Processing, Predictive Analytics, Security, Software","Bangalore, Karnataka, India",Couture.ai is a platform that provides AI and machine learning models in production at scale.,Less than $1M,Active,2017,info@couture.ai,—,"Artificial Intelligence (AI), Data and Analytics, Hardware, Privacy and Security, Science and Engineering, Software",2,"Prateek Srivastava, Shobhit Agarwal",11-50,3,Seed,—,—,—,—,186,—,—,—,0
Codilar Technologies,E-Commerce,"Bangalore, Karnataka, India",Codilar is an Ecommerce development company strongly focusing on Magento. We comprise of certified Magento developers and Solution experts,$1M to $10M,Active,2015,mahaveer@codilar.com,—,Commerce and Shopping,4,"Arshad M., Hashid Hameed, Mahaveer Devabalan, Tamjeed Qazi",51-100,—,—,—,—,—,—,"21,770",-20.29%,27.08%,—,"1,117"
TriOcula Technologies,"Artificial Intelligence (AI), Electronics, Health Care, Information Technology, Machine Learning, Software","Bengaluru, Karnataka, India",AR and AI based Surgical Navigation and Simulators,—,Active,2016,hello@triocula.com,—,"Artificial Intelligence (AI), Consumer Electronics, Data and Analytics, Hardware, Health Care, Information Technology, Science and Engineering, Software",3,"Abhishek Venkataram, Aravind Upadhyaya, Sanidhya Rasiwasia",1-10,1,Seed,"$50,000","$50,000",—,—,—,—,—,—,—
EasyLeadz,"B2B, Big Data, Database, Lead Generation, Recruiting, SaaS, Sales, Sales Automation, Software","New Delhi, Delhi, India",EasyLeadz is a B2B Sales Intelligence Platform for getting connected with your ideal prospects by providing their direct contact numbers.,$10M to $50M,Active,2016,shreyaa@easyleadz.com,—,"Data and Analytics, Information Technology, Other, Professional Services, Sales and Marketing, Software",3,"Amit Rawat, Nitin Bajaj, Shreyaa Ratra",11-50,—,—,—,—,—,—,"351,076",1.97%,84.31%,—,282
lessburn,"Advertising, Business Information Systems, Customer Service, Digital Marketing, Lead Generation, Marketing","Coimbatore, Tamil Nadu, India",lessburn is a marketing and advertising firm that offers business information and digital marketing services.,$10M to $50M,Active,2016,wecando@lessburn.com,—,"Advertising, Information Technology, Other, Professional Services, Sales and Marketing",1,Ramesh Srinivasan,101-250,—,—,—,—,—,—,"1,456",-87.33%,377.11%,—,792
Finnable Loan Customer Care Number,"Financial Services, FinTech, Small and Medium Businesses","Bangalore, Karnataka, India","Finnable is a non-banking finance company that offers consumer lending, personal loans, and financial services.",$1M to $10M,Active,2016,info@finnable.com,—,"Financial Services, Other",3,"Amit Arora, Nitin Gupta, Viraj Tyagi",251-500,—,—,—,—,Growing,—,"486,378",-4%,143.85%,—,"1,329"
Qdesq,"Facility Management, Internet, PropTech","Gurgaon, Haryana, India","Qdesq is India's largest tech-enabled brokerage-free platform for today’s workforce to search, sort, and book a flexible workspace.",$1M to $10M,Active,2015,lavesh@qdesq.com,—,"Internet Services, Real Estate",2,"Lavesh Bhandari, Paras Arora",101-250,5,Early Stage Venture,—,—,Growing,High,"38,284",208.99%,136.45%,—,707
IIDE - The Digital School,"E-Learning, EdTech, Education","Mumbai, Maharashtra, India",IIDE is India's #1 Digital Skills Learning Platform,$1M to $10M,Active,2016,hello@iide.co,—,"Education, Software",2,"Karan Shah, Karan Shah",51-100,—,—,—,—,—,—,"244,845",-2.94%,-38.20%,—,419
Fincash.com,"Crowdfunding, Finance, Financial Services, FinTech, Internet, Management Consulting, Wealth Management","Mumbai, Maharashtra, India",A startup in the personal finance space in India.,$1M to $10M,Active,2016,support@fincash.com,—,"Financial Services, Internet Services, Professional Services",2,"Gaurav Perti, Pawan Kumar",11-50,2,Seed,"$250,000","$250,000",—,—,"114,567",-27.80%,-29.33%,—,159
WovV Technologies- Global Business Productivity SaaS company,"Information Technology, Marketing, PaaS, Project Management, Retail, SaaS, Software, Web Development","Mumbai, Maharashtra, India",Best Business productivity solution provider | Best software company in India | Best Employer of 2022 | SaaS Software Company,$10M to $50M,Active,2016,sales@wovvtech.com,—,"Administrative Services, Commerce and Shopping, Information Technology, Other, Sales and Marketing, Software",—,—,251-500,—,—,—,—,—,—,830,-97.11%,61.40%,—,439
Barosi,"Farmers Market, Fast-Moving Consumer Goods, Food and Beverage, Food Delivery, Food Processing, Grocery, Nutrition, Organic Food","Gurgaon, Haryana, India","Barosi is an authentic food brand which produces Pure, Local & Wholesome Indian food Like Ghee, Cold Pressed Oils, Jaggery, Pickles & Milk.",—,Active,2016,care@barosi.in,—,"Consumer Goods, Food and Beverage, Health Care, Real Estate, Transportation",1,Durlabh Kumar Rawat,11-50,1,Seed,—,—,—,—,"2,025",-68.48%,-79.47%,—,269
Dhobi G,"Laundry and Dry-cleaning, Logistics, Mobile Apps, Web Apps","Chennai, Tamil Nadu, India","Hyperlocal, Laundry, Dry Cleaning, Mobile App, Laundry Aggregator",—,Active,2016,care@dhobig.com,—,"Apps, Clothing and Apparel, Mobile, Software, Transportation",3,"Ankur Gupta, Daksh Sabharwal, Ravi Ranjan",11-50,—,—,—,—,—,—,"2,762",-93.78%,500%,—,30
TalentXO,"Employment, Recruiting, Skill Assessment, Staffing Agency","Bengaluru, Karnataka, India","TalentXO is an HR-Tech startup that offers staffing, skill assessment, talent acquisition, recruitment, assistance, and employment services.",—,Active,2015,—,—,"Administrative Services, Education, Professional Services",1,Varun Kabra,11-50,—,—,—,—,—,—,"6,528",-71.54%,-25.78%,—,426
CallerDesk,"Call Center, Information Technology, SaaS, Software, Telecommunications","Noida, Uttar Pradesh, India",Callerdesk is a patent-granted cloud telephony company that provides virtual call center solutions to businesses all over India.,Less than $1M,Active,2016,kaushal@callerdesk.io,—,"Administrative Services, Hardware, Information Technology, Software",2,"Kaushal Bansal, Rajesh Dimania",51-100,1,Seed,—,—,Growing,—,"5,609",68.29%,-63.02%,1,531
Funcell,"Gaming, PC Games, Software","Kolkata, West Bengal, India",Funcell Games is a startup that develops unique educational games for all age groups.,Less than $1M,Active,2016,hello@funcellgames.com,—,"Gaming, Software",1,Abhishek Malpani,101-250,—,—,—,—,—,—,924,31.81%,454.35%,—,255
NeenOpal Inc.,"Analytics, Artificial Intelligence (AI), Big Data, Business Intelligence, Predictive Analytics","Bengaluru, Karnataka, India","NeenOpal services offers Data Mining, Forecasting, Predictive Statistics, Mathematical Modelling, Optimisation and Big Data Analytics.",$1M to $10M,Active,2016,himanshu.bahmani@neenopal.com,—,"Artificial Intelligence (AI), Data and Analytics, Science and Engineering, Software",3,"Himanshu Bahmani, Nished Singhal, Pavel Gupta",11-50,—,—,—,—,—,—,"3,638",-13.59%,102.65%,—,229
Venture Finance Solutions,"Financial Services, Venture Capital","Bangalore, Karnataka, India",Assists early stage ventures in navigating through complex investor requirements and expectations.,—,Closed,2017,info@venturefinsolutions.com,—,"Financial Services, Lending and Investments",—,—,1-10,1,Seed,"$50,000","$50,000",—,—,—,—,—,—,—
SportsPal,"Fitness, Lifestyle, Sports, Wellness","Delhi, Delhi, India",SportsPal matches you with nearby sports buddies with similar interests and abilities.,—,Closed,2016,contact@sportspal.in,—,"Community and Lifestyle, Health Care, Sports",1,Akshay Gupta,1-10,1,Seed,"$38,500","$38,500",—,—,—,—,—,—,—
Cowrks,"Commercial Real Estate, Coworking, Property Management","Bengaluru, Karnataka, India","CoWrks is a premium coworking solution provider for businesses of all sizes. built for startups, and Fortune 500s.",$1B to $10B,Active,2016,communication@cowrks.com,—,Real Estate,1,Sidharth Menda,251-500,—,—,—,—,Growing,—,"4,719",-86.14%,46.32%,—,199
iamneo.ai,"Artificial Intelligence (AI), College Recruiting, Corporate Training, EdTech, Education, Recruiting, Software","Coimbatore, Tamil Nadu, India",iamneo.ai is an Ed-Tech company that delivers learning and recruitment experience through its ML-AI powered platform.,$50M to $100M,Active,2016,—,—,"Administrative Services, Artificial Intelligence (AI), Data and Analytics, Education, Professional Services, Science and Engineering, Software",5,"Aasif Iqbal J, Arumugham Sankaran, Obuli Chandran, Senthilkumar Tp, Suresh Shanmugam",101-250,—,—,—,—,—,—,"6,605",90.13%,7.53%,—,514
DataGlen,"Analytics, Big Data, Energy, Internet of Things, Solar","Bangalore, Karnataka, India","DataGlen is an IoT & AI-based asset management solutions that build, integrate, and deploy energy applications.",—,Active,2015,—,—,"Data and Analytics, Energy, Internet Services, Natural Resources, Sustainability",3,"Deva P. Seetharam, Sunil Ghai, Tanuja Ganu",1-10,1,—,"$25,000","$25,000",—,—,—,—,—,—,—
Primechain Technologies,"Banking, Blockchain, Cryptocurrency, Financial Services, FinTech, Information Technology, Insurance, Mobile Payments, Payments","Pune, Maharashtra, India","Primechain Technologies is a young Indian startup with the mission of ""building blockchains for a better world"".",$1M to $10M,Active,2016,info@primechain.in,—,"Blockchain and Cryptocurrency, Financial Services, Information Technology, Lending and Investments, Mobile, Other, Payments, Software",1,Shinam Arora,—,—,—,—,—,—,—,—,—,—,—,—
PrediQt,"Analytics, Artificial Intelligence (AI), Business Intelligence, Generative AI, Machine Learning, Predictive Analytics","Salt Lake City, West Bengal, India",PrediQt is an AI/ML and Data Analytics startup empowering businesses to leverage data-driven insights for strategic decision-making.,$1M to $10M,Active,2017,info@prediqt.it,—,"Artificial Intelligence (AI), Data and Analytics, Science and Engineering, Software",5,"Abhishek Nandy, Indranil Mukhopadhyay, Kalpadip Basu, Kalyan Kar, Subhalakshmi Samanta",101-250,—,—,—,—,—,—,—,—,—,—,—
Skill Circle,"Education, Training","New Delhi, Delhi, India",Skill Circle is a digital learning institute.,—,Active,2017,hello@skillcircle.in,—,Education,1,Shivam Ahuja,51-100,1,Seed,—,—,—,—,"16,392",-78.44%,73.95%,—,454
elth.ai,"Artificial Intelligence (AI), Health Care, Medical","Bangalore, Karnataka, India",elth.ai The future of health care is here.,—,Closed,2016,contact@elth.ai,—,"Artificial Intelligence (AI), Data and Analytics, Health Care, Science and Engineering, Software",2,"Akhila Srinath, Akula Srinath",1-10,1,Seed,"$38,500","$38,500",—,—,—,—,—,—,—
Benepik,"Communications Infrastructure, Human Resources, Mobile","Gurgaon, Haryana, India",Benepik is an HR Technology start-up that helps organizations achieve superior results through an engaged and motivated workforce.,—,Active,2015,info@benepik.com,—,"Administrative Services, Hardware, Mobile",2,"Saurabh Jain, Yogesh Misra",11-50,1,Seed,—,—,—,—,393,-78.77%,608.33%,—,0
RinseUp,"E-Commerce, Health Care","Bangalore, Karnataka, India",RinseUp is next gen. fabric care company changing the Industry one vertical at a time. Robost team with a blend of core technology,—,Closed,2017,corporate@rinseup.com,—,"Commerce and Shopping, Health Care",2,"Dileep Katkuri, Vikram Raja",1-10,1,Seed,"$75,000","$75,000",—,—,—,—,—,—,—
Qrata,"Consulting, Human Resources, Recruiting","Mumbai, Maharashtra, India",Qrata is a data driven recruitment startup that uses a combination of technology and innovative services.,—,Active,2016,contact@qrata.co,—,"Administrative Services, Professional Services",2,"Monish Kulkarni, Prajakta Kulkarni",1-10,—,—,—,—,—,—,186,—,—,—,0
Magicmind Technologies Limited,"Digital Marketing, Graphic Design, Information Technology, Software, UX Design, Web Design, Web Development","Kolkata, West Bengal, India","Magicminds, headquartered in the USA with branches in India, is a leading provider of custom software solutions.",$50M to $100M,Active,2016,hello@magicminds.io,—,"Design, Information Technology, Sales and Marketing, Software",1,Rajkumar Prasad,101-250,—,—,—,—,—,—,"1,859",53%,-46.33%,—,139
WeMakeScholars,"Financial Services, FinTech, Higher Education","Hyderabad, Andhra Pradesh, India",WeMakeScholars helps study abroad aspirants arranging finance through Scholarships and Education Loans.,$1M to $10M,Active,2015,hello@wemakescholars.com,—,"Education, Financial Services",2,"Arjun R Krishna, Damini Mahajan",101-250,—,—,—,—,—,—,"566,874",-10.95%,15.77%,—,602
Legal 360,"Consulting, Legal, Product Management, Service Industry","Chandigarh, Chandigarh, India",Products & Services for Lawyers & Judges of India,—,Closed,2015,pradeep@legal360.in,—,"Other, Professional Services",—,—,11-50,2,Seed,"₹5,000,000","₹5,000,000",—,—,—,—,—,—,—
GoYaNo,"Mobile, Restaurants","Gurgaon, Haryana, India",GoYaNo is a crowd-sourcing community that helps users explore and book events.,Less than $1M,Closed,2015,hello@goyano.com,—,"Food and Beverage, Mobile",3,"Gaurav Singh, Gaurav Singh, Nitin Sharma",1-10,1,Seed,"$50,000","$50,000",—,—,—,—,—,—,—
Benow,"Financial Services, Mobile Apps, Payments","Mumbai, Maharashtra, India","Benow is a digital payment platform for SME merchants, brands, and NGOs.",—,Active,2016,careers@benow.in,—,"Apps, Financial Services, Mobile, Payments, Software",2,"Soorraj VS, Sudhakar Ram",11-50,1,M&A,—,—,—,—,"655,430",172.88%,-24.81%,—,703
Yo!Kart,"E-Commerce, E-Commerce Platforms, Marketplace","Mohali, Punjab, India",Yo!Kart is a feature-rich eCommerce solution enabling entrepreneurs to launch online multi-vendor marketplaces.,$1M to $10M,Active,2015,sales@fatbit.com,—,"Commerce and Shopping, Internet Services",1,Manish Bhalla,51-100,—,—,—,—,—,—,"13,798",6.54%,123.88%,—,600
Feedough,"Education, Internet, Marketing, Social Media","New Delhi, Delhi, India",Feedough is the one-stop resource for everything related to startups.,—,Active,2016,contact@feedough.com,—,"Education, Internet Services, Media and Entertainment",1,Aashish Pahwa,1-10,—,—,—,—,—,—,"465,311",24.36%,25.75%,—,337
TechVariable,"Consulting, Information Technology, Mobile Apps, Software, Web Apps, Web Design, Web Development","Guwahati, Assam, India",TechVariable is an end-to-end product development company for tech startups.,—,Active,2015,nilotpal@techvariable.com,—,"Apps, Design, Information Technology, Mobile, Professional Services, Software",3,"Nilotpal Boruah, Ratnadeep Bhattacharjee, Utpal Sarmah",11-50,—,—,—,—,—,—,"1,142",76.23%,26.32%,—,24
InstaFinancials,"Analytics, Artificial Intelligence (AI), Business Development, Business Information Systems, FinTech, Information Services, Market Research, Software","Bangalore, Karnataka, India",InstaFinancials is an award-winning Corporate Intelligence Platform incubated by SAP Labs and Accelerated by Axis Bank,$1M to $10M,Active,2016,Raji@InstaFinancials.com,—,"Artificial Intelligence (AI), Data and Analytics, Design, Financial Services, Information Technology, Professional Services, Science and Engineering, Software",3,"Rajesh Anand, Raji M., Uday Khemka",11-50,—,—,—,—,—,—,"76,660",-49.97%,-30.28%,—,396
