Mazinda,"E-Commerce, Online Portals, Shopping","Gorakhpur, Uttar Pradesh, India",Mazinda is a hyperlocal ecommerce startup that aims to revolutionize the shopping experience with delivery services.,—,Active,2021,contact@mazinda.com,Seed,"Commerce and Shopping, Internet Services",—,—,11-50,1,Seed,—,—,—,—,93,—,—,—,0
Tracxn,"Analytics, Big Data, Enterprise Software, Information Technology, Software, Venture Capital","Bengaluru, Karnataka, India",The largest data platform of Startups,$1M to $10M,Active,2013,neha@tracxn.com,—,"Data and Analytics, Financial Services, Information Technology, Lending and Investments, Software",2,"Abhishek Goyal, Neha Singh",101-250,6,—,"$7,500,000","$7,500,000",—,—,"3,445,178",15.12%,-6.96%,—,334
Livspace,"E-Commerce, Furniture, Interior Design","Bengaluru, Karnataka, India","Livspace is a home interiors and improvement platform connecting people to designers, services, and products.",$100M to $500M,Active,2014,info@livspace.com,—,"Commerce and Shopping, Consumer Goods, Design, Real Estate",3,"Anuj Srivastava, Ramakant Sharma, Saurabh Jain",1001-5000,10,Late Stage Venture,"$427,485,638","$431,577,146",Growing,High,"1,015,288",9.86%,-34.55%,—,360
Chalo,"Big Data, Information Services, Real Time, Transportation","Mumbai, Maharashtra, India",Chalo is a transportation technology startup offering a transportation app that delivers real-time transit information.,$10M to $50M,Active,2014,contact@chalo.com,—,"Data and Analytics, Information Technology, Other, Transportation",5,"Dhruv Chopra, Mohit Dubey, Nikhil Aggarwal, Priya Singh, Vinayak Bhavnani",101-250,10,Late Stage Venture,"$131,890,000","$143,890,000",—,—,"284,111",4.17%,-11.55%,—,245
HealthPlix,"Artificial Intelligence (AI), Health Care, Internet, mHealth","Bangalore, Karnataka, India",HealthPlix is a digital health platform that uses AI technologies to support clinical decisions.,$10M to $50M,Active,2014,ritesh.shete@healthplix.com,—,"Artificial Intelligence (AI), Data and Analytics, Health Care, Internet Services, Mobile, Science and Engineering, Software",2,"Raghuraj Sunder Raju, Sandeep Gudibanda",251-500,5,Late Stage Venture,"$42,523,899","$44,523,899",Growing,—,"695,871",-4.79%,-11.61%,—,"1,919"
Impact Guru,"Creative Agency, Crowdfunding, EdTech, Internet, Medical, Non Profit, Personal Health","Mumbai, Maharashtra, India","Harvard incubated crowdfunding platform for nonprofits, social enterprises, startups, and individuals.",—,Active,2014,info@impactguru.com,—,"Content and Publishing, Education, Financial Services, Health Care, Internet Services, Media and Entertainment, Other, Social Impact, Software",2,"Khushboo Jain, Piyush Jain",501-1000,6,Seed,"$4,200,000","$4,200,000",Growing,—,"792,675",-16.97%,-47.58%,—,303
Wicked Ride Adventure Services,"Automotive, Last Mile Transportation, Peer to Peer, Ride Sharing","Bangalore, Karnataka, India",Peer-to-Peer motor vehicles sharing platform.,$1M to $10M,Active,2014,reservations@wickedride.com,—,"Other, Transportation",3,"Anil G, Varun Agni, Vivekananda Hallekere",101-250,6,—,"$24,444,940","$24,451,732",—,—,537,—,—,—,0
Eduisfun,"E-Learning, EdTech, Education, Software","Mumbai, Maharashtra, India",Edtech startup for school children with lessons mapped to CBSE and ICSE curriculums.,Less than $1M,Active,2014,support@eduisfun.com,—,"Education, Software",2,"Jatin Solanki, Praveen Tyagi",51-100,1,—,"$28,000,000","$28,000,000",—,—,—,—,—,—,—
enguru,"Apps, Education, Language Learning","Bangalore, Karnataka, India",enguru offers an app that helps users learn English through interactive games and conversations.,$1M to $10M,Active,2014,—,—,"Apps, Education, Software",2,"Arshan Vakil, Tahem Verma",11-50,4,M&A,"$4,177,591","$4,177,591",—,—,—,—,—,—,—
Avishkaar,"EdTech, Education","Delhi, Delhi, India",Leading Ed-Tech startup driving the Maker Revolution in India.,$100M to $500M,Active,2014,support@avishkaar.cc,—,"Education, Software",2,"Rajeev Gaba, Tarun Bhalla",51-100,3,Seed,"₹100,000,000","₹100,000,000",Growing,High,—,—,—,—,—
Belong,"Big Data, Internet, Recruiting","Bangalore, Karnataka, India",Recruitment startup based in Bangalore.,Less than $1M,Active,2014,hello@belong.co,—,"Data and Analytics, Internet Services, Professional Services",3,"Rishabh Kaul, Sudheendra Chilappagari, Vijay Sharma",11-50,3,—,"$15,000,000","$15,000,000",—,—,447,-8.59%,325%,—,0
Voonik,"Apps, E-Commerce, Fashion, Lifestyle, Online Portals","Bengaluru, Karnataka, India",India's first online shopping store for women with handpicked items for personalized purchase.,$10M to $50M,Active,2013,support@voonik.com,—,"Apps, Clothing and Apparel, Commerce and Shopping, Community and Lifestyle, Design, Internet Services, Software",2,"Navaneetha Krishnan, Sujayath Ali",101-250,5,M&A,"$31,500,000","$34,500,000",—,—,354,-68.11%,1886.67%,—,8
Taskbob,"Beauty, E-Commerce, Professional Services, Software","Mumbai, Maharashtra, India","Taskbob facilitates instant, high-quality home services for customers while improving productivity for servicemen.",$1M to $10M,Closed,2014,support@taskbob.com,—,"Commerce and Shopping, Consumer Goods, Other, Software",2,"Abhiroop Medhekar, Aseem Khare",1-10,3,Early Stage Venture,"$5,700,000","$5,750,000",—,—,—,—,—,—,—
Aibono,"Agriculture, Analytics, Farming, Information Technology, Predictive Analytics","Bangalore, Karnataka, India","Aibono uses data instruments, predictive analytics, and process improvements to help farmers improve yields.",$1M to $10M,Closed,2014,contact@airwood.in,—,"Agriculture and Farming, Artificial Intelligence (AI), Data and Analytics, Information Technology, Software",1,Vivek Rajkumar,51-100,6,Seed,"$5,508,597","$5,508,597",—,—,—,—,—,—,—
Myra,"Apps, Health Care, Pharmaceutical","Bangalore, Karnataka, India",Myra is a unique solution that makes buying medicines fast and efficient.,$1M to $10M,Closed,2014,help@myramed.in,—,"Apps, Health Care, Software",2,"Anirudh Coontoor, Faizan Aziz",101-250,3,M&A,"₹128,750,000","₹128,750,000",—,—,53,-68.82%,—,—,0
EnerComp Solutions,"Artificial Intelligence (AI), Drone Management, Drones, Manufacturing","Ahmedabad, Gujarat, India","EnerComp Solutions is a drone manufacturing, services, and AI tech startup.",—,Active,2013,—,—,"Artificial Intelligence (AI), Consumer Electronics, Consumer Goods, Data and Analytics, Hardware, Manufacturing, Science and Engineering, Software",1,Jatin Patel,11-50,2,Seed,"₹41,000,000","₹41,000,000",—,—,"1,356",-58.06%,-86.99%,—,275
Jobspire,"Computer, Employment, Software","Bengaluru, Karnataka, India",Jobspire is a visual and experiential job search platform helping Indians find jobs they'll truly love.,$1M to $10M,Closed,2014,support@jobspire.net,—,"Consumer Electronics, Hardware, Professional Services, Software",4,"Kartik Luke Singh, Mohak Dhingra, Sandesh Kini, Varun Mayya",1-10,1,M&A,"$262,000","$262,000",—,—,—,—,—,—,—
Pi Beam,Automotive,"Chennai, Tamil Nadu, India",Pi Beam is a startup that makes electric tricycles.,$1M to $10M,Active,2013,—,Seed,Transportation,3,"Jacob Thekkekara, Manu Iyer, Visakh Sasikumar",1-10,4,Seed,"$2,819,235","$2,819,235",—,—,—,—,—,—,—
Chizel,"3D Printing, Manufacturing, Product Design","Pune, Maharashtra, India",Chizel is the world's most advanced cloud platform for on-demand manufacturing in 3D Printing and CNC Machining.,$1M to $10M,Closed,2014,social@chizel.io,M&A,"Design, Manufacturing",3,"Devang Saini, Ravi Ranjan, Yash Rane",11-50,2,M&A,"₹72,200,000","₹72,200,000",—,—,—,—,—,—,—
Walnut Knowledge Solutions,"Content, Content Creators, Education, Higher Education, Primary Education, Secondary Education","Bangalore City, Karnataka, India",Walnut Knowledge Solutions uses questions and stories to aid learning for kids and engage audiences across platforms.,$1M to $10M,Active,2014,contact@walnuts.co.in,Seed,"Education, Media and Entertainment",2,"Raghav Chakravarthy, Sachin Ravi",11-50,1,Seed,"₹27,000,000","₹27,000,000",—,—,—,—,—,—,—
Kandee Factory,"Organic Food, Snack Food","Chennai, Tamil Nadu, India","Kandee Factory is a Plant-based, healthier confectioners startup.",—,Active,2013,contact@kandeefactory.com,—,Food and Beverage,—,—,11-50,1,Seed,"₹15,000,000","₹15,000,000",—,—,93,—,—,0,—
Fyn,"Electric Vehicle, Logistics, Manufacturing, Sustainability","Bengaluru, Karnataka, India",Fyn is a manufacturing company that provides an EV ecosystem platform for EV logistics.,—,Active,2013,marketing@fynmobility.com,Seed,"Manufacturing, Sustainability, Transportation",—,—,101-250,1,Seed,"$1,700,000","$1,700,000",—,—,540,101.49%,119.23%,—,114
Shopalyst,"E-Commerce, E-Commerce Platforms, Internet, Shopping","Bengaluru, Karnataka, India",Shopalyst is an India-based startup that enables product discovery and shopping.,$1B to $10B,Active,2014,careers@shopalyst.com,Early Stage Venture,"Commerce and Shopping, Internet Services",2,"Mohan Kumar Krishnan, Vibin Balakrishnan",1-10,1,Early Stage Venture,"$2,000,000","$2,000,000",—,—,279,-99.08%,-9.38%,—,29
Chillr,"Android, Apps, Banking, FinTech, iOS, Mobile, Mobile Payments, Windows Phone","Mumbai, Maharashtra, India",Chillr is a mobile and web application that allows users to send money directly between bank accounts using just the mobile number.,$1M to $10M,Closed,2013,talktous@chillr.com,M&A,"Apps, Consumer Electronics, Financial Services",4,"Anoop Sankar, Lishoy Bhaskaran, Mohamed Galib, Sony Joy",51-100,3,M&A,"$7,500,000","$7,500,000",Growing,High,78,—,—,0,—
StyleCracker,"E-Commerce, Fashion, Lifestyle, Online Portals","Mumbai, Maharashtra, India",StyleCracker is an online fashion startup.,$1M to $10M,Active,2013,support@stylecracker.com,Seed,"Clothing and Apparel, Commerce and Shopping",2,"Archana Walavalkar, Dhimaan Shah",101-250,3,Seed,"$3,000,000","$3,000,000",Growing,High,—,—,—,—,—
Actofit,"Fitness, Hardware, Health Care, Lifestyle, Software, Wearables","Mumbai, Maharashtra, India",Actofit is a wearable tech startup that allows you to track your workouts in granularity (75+ gym exercises) and make data-driven decisions.,$1M to $10M,Active,2014,pratik@actofit.com,Seed,"Community and Lifestyle, Consumer Electronics, Hardware, Health Care, Software, Sports",3,"Aashutosh Sharma, Nikhil Lamba, Pratik Saraogi",11-50,3,Seed,"$1,050,000","$1,050,000",Growing,High,715,-42.11%,-86%,—,28
Farmlink,"Agriculture, AgTech, Farming, Food and Beverage","Mumbai, Maharashtra, India",Farmlink is an agri-tech startup that modernizes the supply chain from farm to shelf using socially responsible practices.,$10M to $50M,Active,2014,info@farmlink.in,Seed,"Agriculture and Farming, Food and Beverage",2,"Akshaya Kamath, Sreeram Chellappa",11-50,1,Seed,"$3,000,000","$3,000,000",Growing,—,—,—,—,—,—
X2Fuels and Energy,Renewable Energy,"Chennai, Tamil Nadu, India",X2Fuels and Energy is an early-stage startup that endeavors to develop and deploy thermochemical technologies.,—,Active,2013,info@x2fuelsenergy.com,—,"Energy, Sustainability",—,—,1-10,1,—,"₹61,500,000","₹61,500,000",—,—,—,—,—,—,—
Pipa.Bella,"E-Commerce, Fashion, Jewelry, Retail","Mumbai, Maharashtra, India",Pipa.Bella is an online store aimed at selling fashionable and affordable costume jewelry.,$1M to $10M,Active,2014,hello@pipabella.com,M&A,"Clothing and Apparel, Commerce and Shopping",2,"Shivani Pandya, Shuchi Pandya",11-50,2,M&A,"$1,600,000","$1,600,000",—,—,"2,023",301.39%,2400%,—,"1,400"
Sparrosense,"Artificial Intelligence (AI), Computer Vision, Enterprise Software, Machine Learning, Natural Language Processing, Real-Time, SaaS, Software, Speech Recognition","Gurgaon, Haryana, India",Sparrosense AI Supervisor is a SaaS tool that provides new data and insights for manual shop-floor leveraging AI-powered Video Analytics.,$1M to $10M,Active,2014,deep.learning@silversparro.com,M&A,"Artificial Intelligence (AI), Data and Analytics, Hardware, Other, Science and Engineering, Software",1,Ravikant Bhargava,11-50,2,M&A,"$365,000","$365,000",—,—,—,—,—,—,—
WIMWI Foods,"E-Commerce, Fast-Moving Consumer Goods, Food and Beverage, Food Processing, Snack Food","Bengaluru, Karnataka, India",They bring healthy food options across the globe to Indian kitchens.,$1M to $10M,Active,2014,contact.us@wimwifoods.com,Early Stage Venture,"Commerce and Shopping, Consumer Goods, Food and Beverage, Real Estate",2,"Kanupradeep Subramanian, Srishti Shaw",11-50,3,Early Stage Venture,"$1,054,750","$1,054,750",—,—,—,—,—,—,—
Blowhorn,"Logistics, Transportation, Travel","Bangalore, Karnataka, India",India’s leading asset-light logistics startup moving goods from 1g to 1Ton.,$50M to $100M,Active,2014,shoutout@blowhorn.net,—,"Transportation, Travel and Tourism",3,"Michael Strong, Mithun Srivatsa, Nikhil Shivaprasad",251-500,8,—,"$9,020,000","$9,020,000",—,—,"1,234",-76.69%,-86.20%,—,197
Flinto,"Children, E-Commerce, EdTech, Shopping","Chennai, Tamil Nadu, India",Flinto is an edtech startup aiming to make early childhood development more engaging through creative educational products.,$1M to $10M,Active,2013,care@flintobox.com,Early Stage Venture,"Commerce and Shopping, Community and Lifestyle, Education, Software",3,"Arunprasad Durairaj, Shreenidhi Srirangam, Vijay Gandhi",11-50,6,Early Stage Venture,"$14,535,000","$15,413,257",Growing,—,"5,030",312.63%,-82.77%,0,71
HealthSignz,"Beauty, Health Care, Health Insurance, Information Services, Information Technology, SaaS, Wellness","Hyderabad, Andhra Pradesh, India",HealthSignz is a healthtech startup.,$1M to $10M,Active,2014,people@healthsignz.com,Early Stage Venture,"Consumer Goods, Financial Services, Health Care, Information Technology, Software",4,"HanumanthaRao Chitipothu, RampapaRao Ambati, Surendranath Ch, Vinod P Nair",51-100,5,Early Stage Venture,"$6,499,000","$6,499,000",—,—,93,—,—,—,5
ThinkZone (Odisha),"Association, Communities, Education","Cuttack, Orissa, India",ThinkZone is an award-winning social impact startup that enables women entrepreneurs to drive technology.,—,Active,2014,info@thinkzone.in,—,"Community and Lifestyle, Education, Other",1,Binayak Acharya,11-50,1,—,"$104,000","$104,000",—,—,624,-93.78%,-1.28%,—,77
Bite Club,"Delivery Service, E-Commerce, Food and Beverage, Marketplace","Gurgaon, Haryana, India",Bite Club is a marketplace for chef prepared wholesome meals to deliver to customers.,Less than $1M,Closed,2014,delicious@biteclub.in,—,"Commerce and Shopping, Food and Beverage, Transportation",5,"Aushim Krishan, Prateek Agarwal, Prateek Agarwal, Samiksha Srivastiva, Siddharth Sharma",11-50,3,Seed,"$639,717","$639,717",—,—,—,—,—,—,
WonderPoint Software,"Enterprise Software, Logistics, SaaS, Software","Mumbai, Maharashtra, India",Cloud ERP and Shared Logistics Platform for International Freight Forwarders,Less than $1M,Active,2013,info@wonderpoint.com,—,"Software, Transportation",1,Manish Singh,11-50,1,Seed,"₹30,000,000","₹30,000,000",—,—,78,—,—,0,—
iServeU,"Financial Services, FinTech, Mobile Payments, Payments","Bangalore, Karnataka, India","iServeU Next-Gen Payment Platform, Quick Remittance, Aadhaar Payment, Merchant Payment Solutions, Wallet.",$1M to $10M,Active,2014,info@iserveu.in,—,"Financial Services, Mobile, Payments, Software",2,"Debashis Mohapatra, Umakant Sahoo",251-500,—,M&A,—,—,—,—,"4,405",-33.94%,65.48%,—,978
EGK Foods,"Food and Beverage, Food Processing, Organic Food","Mumbai, Maharashtra, India",EGK Foods is a food processing startup.,—,Active,2014,feedback@egkfoods.com,—,Food and Beverage,1,Satyajit Roy,11-50,1,Seed,"$300,000","$300,000",—,—,—,—,—,—,
Dawailelo,"Fitness, Health Care, Medical Device, Pharmaceutical","Varanasi, Uttar Pradesh, India",Dawailelo is a Varanasi-based healthcare startup that helps people connect with medical stores.,—,Closed,2013,support@dawailelo.com,—,"Health Care, Sports",1,Arpit Sarin,1-10,1,M&A,"$52,000","$52,000",—,—,—,—,—,—,
Eatonomist,"E-Commerce, Food and Beverage, Internet","Gurgaon, Haryana, India",Eatonomist is an online food delivery startup that used to deliver meals prepared in its own kitchens.,—,Closed,2014,info@eatonomist.com,—,"Commerce and Shopping, Food and Beverage, Internet Services",2,"Anisha Dhar, Nupur Khanna",1-10,1,Seed,"$148,065","$148,065",—,—,—,—,—,—,
Magnet,"Enterprise Software, Event Management, Events","Ahmedabad, Gujarat, India","For event organisers, who uses 6-7 different softwares to achieve event success, Magnet provides an integrated, on-the-go platform.",$100M to $500M,Closed,2014,connect@getmagnet.com,—,"Events, Media and Entertainment, Software",2,"Keyur Raval, Tanmay Desai",11-50,2,Seed,"$168,000","$168,000",—,—,—,—,—,—,
Boibanit,"Delivery, Food and Beverage, Marketplace","Vadodara, Gujarat, India",Online food delivery company optimizing the ordering and delivery structure.,$10M to $50M,Closed,2014,info@boibanit.com,Seed,"Administrative Services, Commerce, Food",2,"Abhiudaya Parihar, Arunabh Parihar",11-50,1,Closed,"$150,000","$150,000",—,—,—,—,—,—,—
ProximiT,"Ad Server, Advertising, Marketing","Pune, Maharashtra, India",Advertising-technology startup platform delivering local ads.,$1M to $10M,Closed,2014,inquiries@proximit.in,Seed,"Advertising, Sales and Marketing",2,"Abhay Bora, Yash Muthu",11-50,1,Closed,"$150,000","$150,000",—,—,—,—,—,—,—
IndiQus Technologies,"Cloud Computing, Information Technology, PaaS, SaaS","New Delhi, Delhi, India","Makers of Apiculus, a platform for telcos and MSPs globally to build regional/edge cloud businesses.",—,Active,2013,info@indiqus.com,M&A,"Information Technology, Internet Services",2,"K B Shiv Kumar, Sunando Bhattacharya",11-50,—,Active,—,—,—,—,—,—,—,—,—
OpsTree,"Consulting, Developer Tools, DevOps, IT, Software","Noida, Uttar Pradesh, India",Offers DevOps solutions for startups to large enterprises.,$10M to $50M,Active,2014,connect@opstree.com,—,"IT, Professional Services, Software",1,Shankar Prasad Jha,101-250,—,Active,—,—,—,—,"4,105",-36.08%,152.94%,—,215
Fossbytes,"IT, News, Publishing, Software","Noida, Uttar Pradesh, India",One of the fastest growing tech media startups in India.,—,Active,2014,admin@fossbytes.com,—,"Content and Publishing, IT, Media",2,"Ananda Verma, Arpit Verma",11-50,—,Active,—,—,—,—,"623,733",10.11%,-19.69%,—,155
IndiaBizForSale.com,"Finance, Financial Services, FinTech, Funding Platform, SMBs, Venture Capital","Ahmedabad, Gujarat, India",Platform for buying/selling businesses and connecting with investors.,$1M to $10M,Active,2013,info@indiabizforsale.com,Seed,"Financial Services, Lending and Investments",2,"Bhavin Bhagat, Haripriya Bhagat",11-50,1,Active,—,—,Growing,Medium,"59,777",-7.38%,168.50%,—,341
Tea Post,Coffee,"Ahmedabad, Gujarat, India",Largest mass-market tea café chain in western India.,$1M to $10M,Active,2013,info@teapost.in,Private Equity,Food and Beverage,1,Darshan Dashani,11-50,1,Active,—,—,—,—,"2,379",30%,45.83%,2,105
10000 Start-Ups,"Finance, Funding Platform","Noida, Uttar Pradesh, India",NASSCOM's initiative supporting technology entrepreneurship.,$1M to $10M,Active,2013,startups@nasscom.in,Seed,"Financial Services, Lending and Investments",1,Purnima Sambasivan,501-1000,—,Active,—,—,—,—,"7,267",-79.27%,6.27%,—,288
AppDupe,"App Marketing, Apps, E-Commerce, IT, Internet, Marketing, Mobile Apps, Software, Web Design, Web Development","Chennai, Tamil Nadu, India",Mobile app clone marketplace.,$1M to $10M,Active,2013,info@appdupe.com,—,"Apps, Commerce, IT, Mobile, Software",1,Arjun Subburaj,251-500,—,Active,—,—,—,—,"22,074",140.77%,-59.83%,—,94
Syntizen,"Electronics, FinTech, IT, Software","Hyderabad, Andhra Pradesh, India","Instant, paperless, and authentic customer onboarding solution for industries.",$1M to $10M,Active,2014,info@syntizen.com,M&A,"Consumer Electronics, Financial Services, IT, Software",3,"Dinesh Desu, Siddharth Kukatlapalli, Vamsi Kotte",101-250,2,Active,—,—,—,Medium,"1,065",—,—,—,80
AIMDek Technologies Inc.,"Consulting, Health Care, IT, Software, Web Dev","Ahmedabad, Gujarat, India",End-to-end consulting and engineering services for stealth startups and mid-size ISVs.,$1M to $10M,Active,2014,sales@aimdek.com,—,"Health Care, IT, Professional Services",—,—,101-250,—,Active,—,—,—,—,"1,827",52.38%,-76.70%,—,24
JstJobs,"Employment, Search Engine","Mumbai, Maharashtra, India",Job search engine and human capital management startup.,$1M to $10M,Closed,2014,—,Seed,"Internet Services, Professional Services",1,Nilesh Thorve,11-50,2,Closed,"$700,000","$700,000",—,—,—,—,—,—,—
Kryptobees,"Blockchain, Cryptocurrency, IT, Software","Madurai, Tamil Nadu, India","Blockchain and Web3 development company, successful in delivering over 750+ projects.",—,Active,2013,business@kryptobees.com,—,"Blockchain, IT, Payments, Software",1,Priya Balan,251-500,—,Active,—,—,—,—,"12,674",205.77%,4.83%,—,217
Fluper Ltd.,"Business Development, IT, Software, Web Dev","Noida, Uttar Pradesh, India",Leading ICT solutions provider.,$10M to $50M,Active,2013,enquiry@fluper.com,—,"IT, Professional Services, Software",1,Anshul Sharma,251-500,—,Active,—,—,—,—,"2,298",18.39%,-33.78%,—,547
StartupTalky,"Communities, Media and Entertainment","Bangalore, Karnataka, India",Dedicated to serving the startup ecosystem.,—,Active,2014,shubham@startuptalky.com,—,"Community and Lifestyle, Media",1,Shubham Kumar,11-50,—,Active,—,—,—,—,"327,093",0.75%,-64.27%,—,234
Stirring Minds,"Coworking, Freelance, Incubators","New Delhi, Delhi, India",Initiative to support and nurture entrepreneurial minds.,—,Active,2013,info@stirringminds.com,—,"Financial Services, Professional Services",3,"Hitesh Joshi, Pranav Bhatia, Shanu Trehan",11-50,—,Active,—,—,—,—,2,-97.94%,20.48%,—,0
EngineerBabu,"Apps, Mobile, Software","Indore, Madhya Pradesh, India",Technology investment company for startups.,Less than $1M,Active,2014,hello@engineerbabu.com,Seed,"Apps, Mobile, Software",2,"Aditi Chaurasia, Mayank Pratap",51-100,1,Active,—,—,—,—,680,19.72%,-40%,—,9
Focaloid Technologies,"Information Technology, Mobile","Bangalore, Karnataka, India",Focaloid is a Digital Solutions providing Company that focuses on developing value-adding technology solutions with user-engaging designs.,$1M to $10M,Active,2013,findus@focaloid.com,Seed,"Information Technology, Mobile",3,"Anish Prakash, Prasobh Veluthakkal, Venkat Ramakrishnan",11-50,1,Seed,"₹500,000","₹500,000",—,—,912,173.05%,347.61%,—,"1,589"
Emizen Tech,"E-Commerce, Information Technology, iOS, Mobile, Software","Jaipur, Rajasthan, India","We are a leading eCommerce development, software & mobile app development company providing solutions globally.",—,Active,2013,info@emizentech.com,—,"Commerce and Shopping, Information Technology, Mobile, Platforms, Software",3,"Amit Samsukha, Virendra Sharma, Vivek Khatri",101-250,—,—,—,—,—,—,"33,452",-46.32%,131.34%,—,"1,159"
LawRato.com,"Advice, Legal","New Delhi, Delhi, India",LawRato is a legal tech startup that finds and hires expert lawyers in any city or court.,$100M to $500M,Active,2013,contact@lawrato.com,—,"Media and Entertainment, Professional Services",2,"Nikhil Sarup, Rohan Mahajan",1-10,2,Seed,—,—,—,—,"1,270,903",45.32%,-49.40%,—,379
W3villa Technologies,"Information Technology, Software","Noida, Uttar Pradesh, India","W3villa Technologies is a leading software development company. Expertise in Blockchain, Mobile, Web app, and enterprise solution.",$1M to $10M,Active,2014,contact@w3villa.com,—,"Information Technology, Software",1,Ishank Gupta,101-250,—,—,—,—,—,—,"3,440",34.64%,46.75%,—,361
VT Netzwelt,"Digital Marketing, E-Commerce, EdTech, Financial Services, Health Care, Manufacturing, Medical, Retail, Software, Wholesale","Mohali, Punjab, India","Mobile, Web & eCommerce Software Development Company",—,Active,2013,info@vtnetzwelt.com,—,"Commerce and Shopping, Education, Financial Services, Health Care, Manufacturing, Sales and Marketing, Software",2,"Henning Thole, Surender Vikram Singh",101-250,—,—,—,—,—,—,"3,574",100.56%,81.82%,—,280
NeoITO,"Apps, Artificial Intelligence (AI), Internet, Internet of Things, iOS, Machine Learning, Mobile Apps, Software, Web Apps, Web Development","Thiruvananthapuram, Kerala, India","Product Development for Startups, Scaleups and Enterprises",$10M to $50M,Active,2014,info@neoito.com,—,"Apps, Artificial Intelligence (AI), Data and Analytics, Internet Services, Mobile, Platforms, Science and Engineering, Software",1,Faiz Mohamed Haneef,101-250,—,—,—,—,Growing,—,"5,035",-34.93%,-30.69%,—,131
Squareboat,"Android, Information Technology, iOS, Mobile Apps, Search Engine, SEO, Software, Web Design, Web Development","Gurgaon, Haryana, India",Great products for great ideas.,$1M to $10M,Active,2013,gauravgupta@squareboat.com,—,"Apps, Design, Information Technology, Internet Services, Mobile, Platforms, Sales and Marketing, Software",1,Gaurav Gupta,11-50,—,—,—,—,—,—,"3,643",-68.25%,-90.79%,—,35
